roman_id,titre,auteur,genre,annee,langue,nb_mots,richesse,long_moy_phrase,texte_path
6d7b9e94-c2cc-4506-8a39-7870e6f31848,"L'Illustration, No. 1601, 1 novembre 1873",Various,presse,2014,français,17279,0.337,18.88,"C:\Media\Projet\Informatique\M1\Projet MNajib\storage\processed\L'Illustration, No. 1601, 1 novembre 1873_clean.txt"
537a1819-4248-449b-a207-2cbcc8d2d3a6,"Œuvres complètes de Gustave Flaubert, tome 4: L'éducation sentimentale, v. 2",Gustave Flaubert,roman_amour,2016,français,73636,0.2322,11.92,"C:\Media\Projet\Informatique\M1\Projet MNajib\storage\processed\Œuvres complètes de Gustave Flaubert, tome 4 L'éducation sentimentale, v. 2_clean.txt"
965afaf6-6b25-4c06-be4f-8f1f93a3b0c0,Adieu à la France Sur l'embarquement du sieur de Poutrincourt et de son Équipage faisant voile en la terre de Canadas dicte la France Occidentalle,Marc Lescarbot,poetique,2007,français,1286,0.5397,35.75,C:\Media\Projet\Informatique\M1\Projet MNajib\storage\processed\Adieu à la France_clean.txt
ea8312c0-35d1-4f16-8af6-bbd0b52f73fb,"Histoire des salons de Paris (Tome 3/6) Tableaux et portraits du grand monde sous Louis XVI, Le Directoire, le Consulat et l'Empire, la Restauration et le règne de Louis-Philippe Ier",Laure Junot Abrantès,essai,2013,français,85225,0.1915,16.96,C:\Media\Projet\Informatique\M1\Projet MNajib\storage\processed\Histoire des salons de Paris (Tome 3 6)_clean.txt
67081a8e-b6f8-4c1a-89b4-5bcaa9d3e991,Le livre des heures héroïques et douloureuses des années 1914-1915-1916-1917-1918,André Hellé,roman_historique,2024,français,24009,0.2442,15.38,C:\Media\Projet\Informatique\M1\Projet MNajib\storage\processed\Le livre des heures héroïques et douloureuses des années 1914-1915-1916-1917-1918_clean.txt
5d0bf17d-b6b2-4cff-9946-d8b87fe34c13,"L'Illustration, No. 0049, 3 Février 1844",Various,presse,2013,français,25730,0.3251,14.19,"C:\Media\Projet\Informatique\M1\Projet MNajib\storage\processed\L'Illustration, No. 0049, 3 Février 1844_clean.txt"
f20fb038-77b5-4a36-8e9a-1e8fdc11262b,"L'Illustration, No. 0073, 18 Juillet 1844",Various,presse,2015,français,25378,0.3146,18.22,"C:\Media\Projet\Informatique\M1\Projet MNajib\storage\processed\L'Illustration, No. 0073, 18 Juillet 1844_clean.txt"
e69d8073-8d57-4082-be76-16e8b0c4609d,Angelinette,Neel Doff,nouvelle,2023,français,45298,0.2188,15.94,C:\Media\Projet\Informatique\M1\Projet MNajib\storage\processed\Angelinette_clean.txt
8e6fee92-fbfe-4ca9-a829-928cbf94bc63,Pensées sans langage,Francis; Tzara Picabia,poetique,2018,français,3987,0.4981,180.73,C:\Media\Projet\Informatique\M1\Projet MNajib\storage\processed\Pensées sans langage_clean.txt
78c32f76-f002-4272-ac61-cb179d7e36d4,Essai sur le commerce,Richard Cantillon,essai,2020,français,55451,0.1316,35.98,C:\Media\Projet\Informatique\M1\Projet MNajib\storage\processed\Essai sur le commerce_clean.txt
34c7e2ac-4e86-4551-865c-28bf16cf3d96,"Atar-Gull, Un Corsaire, Le Parisien en Mer, Voyages et Aventures sur Mer de Narcisse Gelin. romans maritimes.",Eugène Sue,roman_aventures,2009,français,73679,0.2339,14.37,"C:\Media\Projet\Informatique\M1\Projet MNajib\storage\processed\Atar-Gull, Un Corsaire, Le Parisien en Mer, Voyages et Aventures sur Mer de Narcisse Gelin_clean.txt"
59f0d0fb-314d-4fcc-9e83-74af854caa17,L'histoire sociale au Palais de justice. Plaidoyers philosophiques,Émile de Saint-Auban,histoire,2025,français,76676,0.2039,16.78,C:\Media\Projet\Informatique\M1\Projet MNajib\storage\processed\L'histoire sociale au Palais de justice. Plaidoyers philosophiques_clean.txt
5f8f5c01-11fe-42b4-89f3-58db62a5dfdb,"Correspondance diplomatique de Bertrand de Salignac de La Mothe Fénélon, Tome Cinquième Ambassadeur de France en Angleterre de 1568 à 1575",Bertrand de Salignac,histoire,2012,français,143409,0.1022,41.32,"C:\Media\Projet\Informatique\M1\Projet MNajib\storage\processed\Correspondance diplomatique de Bertrand de Salignac de La Mothe Fénélon, Tome Cinquième_clean.txt"
6055926c-fe51-4051-a492-78b8871a5c09,Le voleur,Georges Darien,roman_amour,2005,français,134803,0.1751,12.73,C:\Media\Projet\Informatique\M1\Projet MNajib\storage\processed\Le voleur_clean.txt
45fcf679-cbf0-40ff-8761-518d02cb31a5,"L'Illustration, No. 0024, 12 Août 1843",Various,presse,2011,français,31005,0.3016,22.65,"C:\Media\Projet\Informatique\M1\Projet MNajib\storage\processed\L'Illustration, No. 0024, 12 Août 1843_clean.txt"
a14358a1-bf40-4442-bf0c-9d6e23364fb8,Conversations d'une petite fille avec sa poupée Suivies de l'histoire de la poupée,Madame de (Sophie de Senneterre) Renneville,jeunesse,2006,français,24347,0.2483,16.32,C:\Media\Projet\Informatique\M1\Projet MNajib\storage\processed\Conversations d'une petite fille avec sa poupée_clean.txt
993d53b1-1b22-4c47-92f1-65b7b91f63ac,Le grand secret,Maurice Maeterlinck,roman_fantastique,2022,français,57011,0.1865,31.41,C:\Media\Projet\Informatique\M1\Projet MNajib\storage\processed\Le grand secret_clean.txt
51b4d3e7-b246-4885-a65c-eafc32d07069,"Ariane, jeune fille russe",Claude Anet,essai,2022,français,48743,0.2005,14.03,"C:\Media\Projet\Informatique\M1\Projet MNajib\storage\processed\Ariane, jeune fille russe_clean.txt"
d6e71855-c0f2-4f28-8408-97afc31400cd,"L'Illustration, No. 3236, 4 Mars 1905",Various,presse,2010,français,10870,0.4082,17.78,"C:\Media\Projet\Informatique\M1\Projet MNajib\storage\processed\L'Illustration, No. 3236, 4 Mars 1905_clean.txt"
f3feae60-b2e6-4400-a81c-c526df64f4d8,Clavecin,Fagus,poetique,2024,français,5208,0.4184,16.55,C:\Media\Projet\Informatique\M1\Projet MNajib\storage\processed\Clavecin_clean.txt
ea338a44-ca02-4b62-aa77-b7439c69cc0e,Bouvard et Pécuchet,Gustave Flaubert,essai,2004,français,85982,0.2548,12.25,C:\Media\Projet\Informatique\M1\Projet MNajib\storage\processed\Bouvard et Pécuchet_clean.txt
1f676064-3f18-4897-a909-657f8cca1b3a,Complices,Robert de Traz,nouvelle,2026,français,53279,0.2179,13.31,C:\Media\Projet\Informatique\M1\Projet MNajib\storage\processed\Complices_clean.txt
b96d14cd-95ee-484f-9de2-84651723905d,A quoi tient l'amour? Contes de France et d'Amérique,Emile; Twain Blémont,roman_historique,2004,français,54209,0.2617,13.4,C:\Media\Projet\Informatique\M1\Projet MNajib\storage\processed\A quoi tient l'amour_clean.txt
6390b161-7c96-4480-92f9-3cb2263f4c40,Catherine de Médicis (1519-1589),Jean-H. (Jean-Hippolyte) Mariéjol,biographie,2011,français,235582,0.1484,17.52,C:\Media\Projet\Informatique\M1\Projet MNajib\storage\processed\Catherine de Médicis (1519-1589)_clean.txt
8777ba0c-5a24-4772-9d26-44add33ef88a,Sur la vaste Terre,Pierre Mille,nouvelle,2022,français,49519,0.2343,17.56,C:\Media\Projet\Informatique\M1\Projet MNajib\storage\processed\Sur la vaste Terre_clean.txt
ecc34a87-0e04-4efe-ba6b-05b9e4a0fe3f,Les possédés,Fyodor; Derély Dostoyevsky,essai,2005,français,244505,0.1235,14.79,C:\Media\Projet\Informatique\M1\Projet MNajib\storage\processed\Les possédés_clean.txt
c8ddba2e-b5b3-4b06-9eb3-cf69e0a15676,Essais de Montaigne (self-édition) - Volume IV,Michel de; Michaud [Translator] Montaigne,essai,2019,français,496710,0.1402,10.81,C:\Media\Projet\Informatique\M1\Projet MNajib\storage\processed\Essais de Montaigne (self-édition) - Volume IV_clean.txt
c3b3f96f-92db-4e92-bf2d-b556a6dc84bb,Michel Strogoff: Pièce à grand spectacle en 5 actes et 16 tableaux,Adolphe d'; Verne Ennery,theatre,2008,français,19759,0.2628,4.89,C:\Media\Projet\Informatique\M1\Projet MNajib\storage\processed\Michel Strogoff Pièce à grand spectacle en 5 actes et 16 tableaux_clean.txt
2aaca0ef-c2be-493c-b05a-7bbfd7d3097b,Sonnets. Volume 8,William; Guizot Shakespeare,poetique,2008,français,20790,0.2665,31.13,C:\Media\Projet\Informatique\M1\Projet MNajib\storage\processed\Sonnets. Volume 8_clean.txt
0834f850-bf1e-4fd2-860f-028738db27b3,Evangeline: Traduction du poème Acadien de Longfellow,Henry Wadsworth; Lemay Longfellow,poetique,2007,français,23375,0.2941,22.96,C:\Media\Projet\Informatique\M1\Projet MNajib\storage\processed\Evangeline Traduction du poème Acadien de Longfellow_clean.txt
97ebe7ad-6aab-44a0-83b5-af38b427b394,Les aventures du capitaine Magon ou une exploration phénicienne mille ans avant l'ère chrétienne,David-Léon; Philippoteaux Cahun,jeunesse,2022,français,113694,0.1347,17.65,C:\Media\Projet\Informatique\M1\Projet MNajib\storage\processed\Les aventures du capitaine Magon_clean.txt
7591bae7-1a4d-4dd5-b103-a4bbb435941a,"Un Cadet de Famille, v. 1/3",Edward John; Dumas Trelawny,roman_aventures,2011,français,74634,0.2077,23.14,"C:\Media\Projet\Informatique\M1\Projet MNajib\storage\processed\Un Cadet de Famille, v. 1 3_clean.txt"
6eb24c8c-fc84-4790-929a-5b071b7196ad,Le dîner interrompu,Ernest Doin,theatre,2004,français,7252,0.3269,7.59,C:\Media\Projet\Informatique\M1\Projet MNajib\storage\processed\Le dîner interrompu_clean.txt
efb2454f-c87f-41f8-8ff0-f111f24c0de7,"Histoire de la Révolution française, Tome 09",Adolphe Thiers,roman_historique,2004,français,91903,0.1626,22.19,"C:\Media\Projet\Informatique\M1\Projet MNajib\storage\processed\Histoire de la Révolution française, Tome 09_clean.txt"
c54b5bd1-6777-45ca-b5d9-e20c985bf98f,Nord-Sud: Amérique; Angleterre; Corse; Spitzberg,René Bazin,voyage,2010,français,58900,0.2421,17.65,C:\Media\Projet\Informatique\M1\Projet MNajib\storage\processed\Nord-Sud Amérique; Angleterre; Corse; Spitzberg_clean.txt
b93079d6-d8be-4096-b438-ad807a6c2689,"Aline et Valcour, ou Le Roman Philosophique. Tome 1",marquis de Sade,roman_amour,2005,français,52421,0.2104,21.63,"C:\Media\Projet\Informatique\M1\Projet MNajib\storage\processed\Aline et Valcour, ou Le Roman Philosophique. Tome 1_clean.txt"
c752522f-5e97-49e1-a876-1915b63dd834,"Le comte de Monte-Cristo, Tome IV",Alexandre; Maquet Dumas,roman_historique,2006,français,119072,0.1648,13.33,"C:\Media\Projet\Informatique\M1\Projet MNajib\storage\processed\Le comte de Monte-Cristo, Tome IV_clean.txt"
d0d04467-502c-44a8-b3ea-91416bb1f6da,Point de lendemain,Vivant Denon,essai,2008,français,8826,0.3679,12.58,C:\Media\Projet\Informatique\M1\Projet MNajib\storage\processed\Point de lendemain_clean.txt
7df3e2b0-88ac-47a3-aee7-4cc1d35ef26c,Histoire de la Nouvelle France Relation derniere de ce qui s'est passé au voyage du sieur de Poutrincourt en la Nouvelle France depuis 10 mois ença,Marc Lescarbot,roman_aventures,2007,français,9126,0.3213,18.87,C:\Media\Projet\Informatique\M1\Projet MNajib\storage\processed\Histoire de la Nouvelle France_clean.txt
42f53255-fdda-408b-a9b9-7551a27253d6,Comment est née la révolution russe,Jacques Bainville,essai,2025,français,17358,0.2723,21.58,C:\Media\Projet\Informatique\M1\Projet MNajib\storage\processed\Comment est née la révolution russe_clean.txt
30860fb6-3fce-4a51-b1de-c2d50e3ccb8b,En voyage,Marie de Grandmaison,jeunesse,2022,français,1428,0.521,12.03,C:\Media\Projet\Informatique\M1\Projet MNajib\storage\processed\En voyage_clean.txt
04b6c8b3-f89f-486f-8701-8c14d51b1929,Les hommes de la guerre d'Orient 11: Le prince du Montenegro,Edmond Texier,histoire,2004,français,10352,0.3564,20.74,C:\Media\Projet\Informatique\M1\Projet MNajib\storage\processed\Les hommes de la guerre d'Orient 11 Le prince du Montenegro_clean.txt
807b9e83-1a5b-421f-8346-abdfbe23fdfa,"L'Illustration, No. 2502, 7 février 1891",Various,presse,2014,français,21355,0.3345,16.22,"C:\Media\Projet\Informatique\M1\Projet MNajib\storage\processed\L'Illustration, No. 2502, 7 février 1891_clean.txt"
066edb59-6268-4f44-8f5f-ade4000b6708,"Le Vallon Aérien Ou, Relation du voyage d'un aéronaute dans un pays inconnu jusqu'à présent; suivie de l'histoire de ses habitans et de la description de leurs moeurs",Jean-Baptiste Mosneron de Launay,roman_science_fiction,2010,français,50149,0.2245,23.4,C:\Media\Projet\Informatique\M1\Projet MNajib\storage\processed\Le Vallon Aérien_clean.txt
b2c0c892-3456-4e8d-b10d-f1e14fa38763,Journal des Goncourt  (Deuxième volume) Mémoires de la vie littéraire,Edmond de; Goncourt Goncourt,biographie,2005,français,75777,0.2313,16.65,C:\Media\Projet\Informatique\M1\Projet MNajib\storage\processed\Journal des Goncourt (Deuxième volume)_clean.txt
a482bbca-a2ef-4930-807f-c70460ca73fb,"Chroniques de J. Froissart, tome 01/13, 1re partie",Jean Froissart,roman_historique,2013,français,86071,0.1706,18.23,"C:\Media\Projet\Informatique\M1\Projet MNajib\storage\processed\Chroniques de J. Froissart, tome 01 13, 1re partie_clean.txt"
9b8341f6-6c56-4878-854f-0b012d32c512,La vie littéraire. Quatrième série,Anatole France,essai,2006,français,91326,0.2061,17.85,C:\Media\Projet\Informatique\M1\Projet MNajib\storage\processed\La vie littéraire. Quatrième série_clean.txt
fd765a4a-dbc0-4bae-8392-5867bed08856,Les Femmes qui tuent et les Femmes qui votent,Alexandre Dumas,essai,2009,français,26615,0.2502,25.74,C:\Media\Projet\Informatique\M1\Projet MNajib\storage\processed\Les Femmes qui tuent et les Femmes qui votent_clean.txt
34a236f7-5c69-49a3-a26c-20571665a565,"L'illustre comédien, ou Le martyre de Sainct Genest",Nicolas-Marc Desfontaines,theatre,2006,français,13847,0.2852,14.38,"C:\Media\Projet\Informatique\M1\Projet MNajib\storage\processed\L'illustre comédien, ou Le martyre de Sainct Genest_clean.txt"
a1b88d14-f8b4-4aeb-a8f2-cc31adf31683,"La femme affranchie, vol. 1 of 2 Réponse à MM. Michelet, Proudhon, E. de Girardin, A. Comte et aux autres novateurs modernes",Madame d' Héricourt,essai,2016,français,54703,0.2098,20.05,"C:\Media\Projet\Informatique\M1\Projet MNajib\storage\processed\La femme affranchie, vol. 1 of 2_clean.txt"
4fc7faa5-296e-4243-b437-56179f869e42,"Œuvres complètes - Volume 1 Poèmes Saturniens, Fêtes Galantes, Bonne chanson, Romances sans paroles, Sagesse, Jadis et naguère",Paul Verlaine,poetique,2005,français,42731,0.2765,15.4,C:\Media\Projet\Informatique\M1\Projet MNajib\storage\processed\Œuvres complètes - Volume 1_clean.txt
bb401507-e4b0-41ea-8eef-6d71d8abe33c,La Prisonnière (Sodome et Gomorrhe III),Marcel Proust,biographie,2019,français,157907,0.1475,27.59,C:\Media\Projet\Informatique\M1\Projet MNajib\storage\processed\La Prisonnière (Sodome et Gomorrhe III)_clean.txt
369e4c90-5ea5-4a5f-b14f-c93a28b9dfd1,Rob-Roy,Walter; Defauconpret Scott,histoire,2005,français,173213,0.1427,21.67,C:\Media\Projet\Informatique\M1\Projet MNajib\storage\processed\Rob-Roy_clean.txt
7c236f1a-930a-4dc5-8ed9-05aa1470848a,"Les châteaux d'Athlin et de Dunbayne (2/2), Histoire arrivée dans les Montagnes d'Écosse.",Ann Ward; Desrais Radcliffe,roman_historique,2020,français,21335,0.254,22.23,"C:\Media\Projet\Informatique\M1\Projet MNajib\storage\processed\Les châteaux d'Athlin et de Dunbayne (2 2), Histoire arrivée dans les Montagnes d'Écosse_clean.txt"
0bdee691-2705-4d7f-be4c-e63e626500c8,La femme française dans les temps modernes,Clarisse Bader,essai,2005,français,126995,0.1755,20.2,C:\Media\Projet\Informatique\M1\Projet MNajib\storage\processed\La femme française dans les temps modernes_clean.txt
5f87ca1a-0902-4091-89c2-c0db61503d18,Le chalet dans la montagne,Eugène Montfort,nouvelle,2025,français,43122,0.2425,15.88,C:\Media\Projet\Informatique\M1\Projet MNajib\storage\processed\Le chalet dans la montagne_clean.txt
59ce9ce9-f42d-49ee-b4ec-3d5caee86c31,En Sicile et en Calabre,Maurice Maeterlinck,voyage,2025,français,9537,0.3534,28.56,C:\Media\Projet\Informatique\M1\Projet MNajib\storage\processed\En Sicile et en Calabre_clean.txt
340790d4-9335-4976-a7cd-6f4f3a5fe1b5,Le médecin malgré lui,Molière,theatre,2007,français,12703,0.3015,7.11,C:\Media\Projet\Informatique\M1\Projet MNajib\storage\processed\Le médecin malgré lui_clean.txt
402adc1c-a3c2-4eea-98fd-6e7044ceb5fa,"Seul, à travers l'Atlantique",Alain Gerbault,voyage,2020,français,26331,0.2316,16.74,"C:\Media\Projet\Informatique\M1\Projet MNajib\storage\processed\Seul, à travers l'Atlantique_clean.txt"
78bf3c34-8c22-4639-8fe9-ed074f9fa743,Les quarante-cinq — Tome 3,Alexandre; Maquet Dumas,histoire,2005,français,78340,0.1826,15.07,C:\Media\Projet\Informatique\M1\Projet MNajib\storage\processed\Les quarante-cinq — Tome 3_clean.txt
2a9716a6-d1c7-4ac6-9c4d-dfb854ad9d71,"Journal du corsaire Jean Doublet de Honfleur, lieutenant de frégate sous Louis XIV Publié d'après le manuscrit autographe avec introduction, notes et additions",Jean; Bréard Doublet,histoire,2013,français,114754,0.16,25.84,"C:\Media\Projet\Informatique\M1\Projet MNajib\storage\processed\Journal du corsaire Jean Doublet de Honfleur, lieutenant de frégate sous Louis XIV_clean.txt"
b5abafc4-a64a-4c1e-bc1e-25d97594aee9,"Les Rues de Paris, tome troisième Biographies, portraits, récits et légendes",Bathild Bouniol,biographie,2011,français,103536,0.2062,25.85,"C:\Media\Projet\Informatique\M1\Projet MNajib\storage\processed\Les Rues de Paris, tome troisième_clean.txt"
2d65b767-bd3c-4714-a0a5-e938d0c5d51d,Aphorismes sur la sagesse dans la vie,Arthur; Cantacuzène Schopenhauer,essai,2011,français,79988,0.1877,30.81,C:\Media\Projet\Informatique\M1\Projet MNajib\storage\processed\Aphorismes sur la sagesse dans la vie_clean.txt
3a4b9406-9910-4725-a1f6-8f1876328c36,Le Désespéré,Léon Bloy,essai,2011,français,103904,0.2259,22.41,C:\Media\Projet\Informatique\M1\Projet MNajib\storage\processed\Le Désespéré_clean.txt
7f07348c-e065-4aff-be9c-609109c1f976,Lettres à Mademoiselle de Volland,Denis Diderot,epistolaire,2015,français,214101,0.137,17.47,C:\Media\Projet\Informatique\M1\Projet MNajib\storage\processed\Lettres à Mademoiselle de Volland_clean.txt
2ce29ab9-6c39-4215-8f7d-57b9f8bbad6a,Variétés Historiques et Littéraires (01/10) Recueil de pièces volantes rares et curieuses en prose et en vers,Edouard [Editor] Fournier,essai,2013,français,86290,0.2297,25.12,C:\Media\Projet\Informatique\M1\Projet MNajib\storage\processed\Variétés Historiques et Littéraires (01 10)_clean.txt
0a8c1175-9e3e-45ad-915d-439e3aca77d0,"Gutenberg, pièce historique en 5 actes, 8 tableaux",Louis Figuier,theatre,2007,français,28073,0.2452,8.93,"C:\Media\Projet\Informatique\M1\Projet MNajib\storage\processed\Gutenberg, pièce historique en 5 actes, 8 tableaux_clean.txt"
4cc45295-9c83-413d-97c9-ee76620808db,Nouveaux Pastels (Dix portraits d'hommes),Paul Bourget,essai,2018,français,92578,0.2041,17.93,C:\Media\Projet\Informatique\M1\Projet MNajib\storage\processed\Nouveaux Pastels (Dix portraits d'hommes)_clean.txt
04eb2583-1f8a-42b7-a567-155a559ec3f4,"Le vieux muet, ou, Un héros de Châteauguay",J. B. (Jean Baptiste) Caouette,histoire,2004,français,77301,0.1946,14.3,"C:\Media\Projet\Informatique\M1\Projet MNajib\storage\processed\Le vieux muet, ou, Un héros de Châteauguay_clean.txt"
24cda2b7-d756-4b93-8d4e-e03646cfe290,"L'Illustration, No. 0075, 1 August 1844",Various,presse,2015,français,23612,0.3112,20.24,"C:\Media\Projet\Informatique\M1\Projet MNajib\storage\processed\L'Illustration, No. 0075, 1 August 1844_clean.txt"
e6e4af74-049e-4345-b6b1-9c786d82cc00,L'Assommoir,Émile Zola,roman_noir,2004,français,160152,0.1428,14.75,C:\Media\Projet\Informatique\M1\Projet MNajib\storage\processed\L'Assommoir_clean.txt
fe9d4a7f-32b8-43c2-b6ed-b8633c311f1f,Histoire de France,Jacques Bainville,histoire,2020,français,158385,0.1397,19.27,C:\Media\Projet\Informatique\M1\Projet MNajib\storage\processed\Histoire de France (pg63478)_clean.txt
bf72e511-03c5-496d-b474-f3e9cb505c13,Poésies populaires Serbes Traduites sur les originaux avec une introduction et des notes,Auguste Dozon,mythe_legende,2006,français,57786,0.2027,24.09,C:\Media\Projet\Informatique\M1\Projet MNajib\storage\processed\Poésies populaires Serbes_clean.txt
1c012a96-ab77-48ac-a1f6-5048071406d6,Les amours de Faustine,Joachim Du Bellay,poetique,2023,français,15657,0.3767,18.68,C:\Media\Projet\Informatique\M1\Projet MNajib\storage\processed\Les amours de Faustine_clean.txt
8a0e827f-b3f5-406a-92c6-0d341addffba,Les etranges noces de Rouletabille,Gaston Leroux,roman_policier,2004,français,74402,0.1899,11.68,C:\Media\Projet\Informatique\M1\Projet MNajib\storage\processed\Les etranges noces de Rouletabille_clean.txt
afdf17c2-a225-4add-b5c8-83497ac34bbc,Histoire de la République de Gênes,Emile Vincens,histoire,2006,français,314025,0.1087,20.05,C:\Media\Projet\Informatique\M1\Projet MNajib\storage\processed\Histoire de la République de Gênes_clean.txt
7be9a1a6-e1d7-4742-a7fd-c97f0b2d25f5,"L'Illustration, No. 0044, 30 Décembre 1843",Various,presse,2012,français,21706,0.3158,22.2,"C:\Media\Projet\Informatique\M1\Projet MNajib\storage\processed\L'Illustration, No. 0044, 30 Décembre 1843_clean.txt"
b321d483-bc91-4023-b6d3-e18d3094eb3a,Le retour d'Imray,Rudyard; Austin-Jackson Kipling,nouvelle,2024,français,67392,0.2055,16.62,C:\Media\Projet\Informatique\M1\Projet MNajib\storage\processed\Le retour d'Imray_clean.txt
77b98615-e5d6-4905-8db9-35dd48e4a6e9,"Caen démoli: Recueil de notices sur des monuments détruits ou défigurés, et sur l'ancien port de Caen",Gaston Lavalley,histoire,2022,français,34095,0.2485,26.04,"C:\Media\Projet\Informatique\M1\Projet MNajib\storage\processed\Caen démoli Recueil de notices sur des monuments détruits ou défigurés, et sur l'ancien port de Caen_clean.txt"
3d557479-7829-4fdd-aeff-adcac16d67d6,"Mémoires du duc de Rovigo, pour servir à l'histoire de l'empereur Napoléon, Tome 3",Anne-Jean-Marie-René Savary,roman_historique,2007,français,95236,0.1556,27.76,"C:\Media\Projet\Informatique\M1\Projet MNajib\storage\processed\Mémoires du duc de Rovigo, pour servir à l'histoire de l'empereur Napoléon, Tome 3_clean.txt"
9e803cbb-c02b-418c-9f35-b184f0ab3272,Napoléon et Alexandre Ier (2/3) L'alliance russe sous le premier Empire,Albert Vandal,roman_historique,2010,français,191537,0.144,24.99,C:\Media\Projet\Informatique\M1\Projet MNajib\storage\processed\Napoléon et Alexandre Ier (2 3)_clean.txt
9780e15d-cf0a-4c5d-964a-be11a702b70a,Le cycle du printemps,Rabindranath; Mirabaud-Thorens Tagore,theatre,2023,français,14177,0.2807,8.11,C:\Media\Projet\Informatique\M1\Projet MNajib\storage\processed\Le cycle du printemps_clean.txt
48aad58e-c0fb-464a-9a8d-ca777826cfc0,L'Odyssée,751? BCE-651? BCE; Calbet Homer,mythe_legende,2016,français,59840,0.1848,22.66,C:\Media\Projet\Informatique\M1\Projet MNajib\storage\processed\L'Odyssée (pg52927)_clean.txt
e673b193-ab46-4367-8b21-dad4476c2605,Le féminisme,Émile Faguet,essai,2019,français,76216,0.1898,18.36,C:\Media\Projet\Informatique\M1\Projet MNajib\storage\processed\Le féminisme_clean.txt
98c7298c-447f-452c-8f05-ab0acaf8af13,"Mémoires d'une contemporaine. Tome 5 Souvenirs d'une femme sur les principaux personnages de la République, du Consulat, de l'Empire, etc...",Ida Saint-Elme,histoire,2009,français,70188,0.2049,20.42,C:\Media\Projet\Informatique\M1\Projet MNajib\storage\processed\Mémoires d'une contemporaine. Tome 5_clean.txt
8486e38d-f7a3-4c7c-8326-53fe38c0e6b7,Le Noël des Petits Gueux,Max Du Veuzit,theatre,2008,français,1905,0.4772,7.81,C:\Media\Projet\Informatique\M1\Projet MNajib\storage\processed\Le Noël des Petits Gueux_clean.txt
607f84d6-e18f-4789-b86d-f312f25154f2,"Histoire des ducs de Normandie, suivie de: Vie de Guillaume le Conquérant",of Jumièges; Gulielmus William,histoire,2020,français,122370,0.1189,24.55,"C:\Media\Projet\Informatique\M1\Projet MNajib\storage\processed\Histoire des ducs de Normandie, suivie de Vie de Guillaume le Conquérant_clean.txt"
dab218bc-85ce-496d-a1ce-5cecc8da4622,Le livre du chevalier de La Tour Landry pour l'enseignement de ses filles,Geoffroy de La Tour Landry,essai,2022,français,101431,0.1445,24.31,C:\Media\Projet\Informatique\M1\Projet MNajib\storage\processed\Le livre du chevalier de La Tour Landry pour l'enseignement de ses filles_clean.txt
516ad19c-5e7b-487f-afee-13f3b714f32c,La vérité en marche: L'affaire Dreyfus,Émile Zola,essai,2018,français,62561,0.1845,21.67,C:\Media\Projet\Informatique\M1\Projet MNajib\storage\processed\La vérité en marche L'affaire Dreyfus_clean.txt
470eb53d-d19c-47ec-aa9d-5ee0c779c50c,"Histoire Anecdotique de l'Ancien Théâtre en France, Tome Second Théâtre-Français, Opéra, Opéra-Comique, Théâtre-Italien, Vaudeville, Théâtres forains, etc...",Albert Du Casse,theatre,2012,français,92622,0.1839,17.59,"C:\Media\Projet\Informatique\M1\Projet MNajib\storage\processed\Histoire Anecdotique de l'Ancien Théâtre en France, Tome Second_clean.txt"
6c6899a7-a8fb-46b6-8072-c317d509a0f4,A Nosseigneurs de l'Assemblée nationale: Mémoire pour les maîtres de postes,Anonymous,roman_historique,2021,français,5990,0.2927,40.51,C:\Media\Projet\Informatique\M1\Projet MNajib\storage\processed\A Nosseigneurs de l'Assemblée nationale Mémoire pour les maîtres de postes_clean.txt
4cd612df-3758-4466-8793-92fb508bcbfc,"Parapilla, poëme en cinq chants",Charles Bordes,poetique,2008,français,5755,0.4405,14.68,"C:\Media\Projet\Informatique\M1\Projet MNajib\storage\processed\Parapilla, poëme en cinq chants_clean.txt"
ae1ef2a7-1e4b-4005-ac12-ef47b0473136,"Le trésor des équivoques, antistrophes, ou contrepéteries",Léon Dupré-Carra,roman_satirique,2020,français,14479,0.4013,33.33,"C:\Media\Projet\Informatique\M1\Projet MNajib\storage\processed\Le trésor des équivoques, antistrophes, ou contrepéteries_clean.txt"
78d2f66d-8d89-4d50-b241-f42ff8c20d55,Un Pélerin d'Angkor,Pierre Loti,voyage,2011,français,26107,0.2831,28.07,C:\Media\Projet\Informatique\M1\Projet MNajib\storage\processed\Un Pélerin d'Angkor_clean.txt
10da991a-6964-491c-b674-a312ffc67b26,La Mal'aria: Etude Sociale,Henri Rochefort,essai,2020,français,81810,0.1995,17.86,C:\Media\Projet\Informatique\M1\Projet MNajib\storage\processed\La Mal'aria Etude Sociale_clean.txt
e0af178b-4d85-4fcb-b0e3-d0c8b229028e,Cours familier de Littérature - Volume 26,Alphonse de Lamartine,essai,2015,français,71668,0.2153,21.85,C:\Media\Projet\Informatique\M1\Projet MNajib\storage\processed\Cours familier de Littérature - Volume 26_clean.txt
