roman_id,titre,auteur,genre,annee,langue,nb_mots,richesse,long_moy_phrase,texte_path
20afc2db-bfd2-422a-83f3-c2dd6027bca6,Œuvres complètes de Guy de Maupassant - volume 16,Guy de Maupassant,essai,2021,français,45394,0.2442,15.48,C:\Media\Projet\Informatique\M1\Projet MNajib\storage\processed\Œuvres complètes de Guy de Maupassant - volume 16_clean.txt
a6cb7b43-31e2-4a24-823c-bf3083374050,Étude sur les maladies éteintes et les maladies nouvelles pour servir à l'histoire des évolutions séculaires de la pathologie,Charles Anglada,histoire,2019,français,202785,0.1488,17.22,C:\Media\Projet\Informatique\M1\Projet MNajib\storage\processed\Étude sur les maladies éteintes et les maladies nouvelles_clean.txt
02a85578-ab2a-4c8a-a8b2-35dba76d8c53,Le grand-ouest des États-Unis,Louis Simonin,voyage,2025,français,71211,0.2045,20.55,C:\Media\Projet\Informatique\M1\Projet MNajib\storage\processed\Le grand-ouest des États-Unis_clean.txt
0bdc5707-f63e-4597-9a96-082cfd381a6d,"Journal des Goncourt (Deuxième série, premier volume) Mémoires de la vie littéraire",Edmond de; Goncourt Goncourt,biographie,2005,français,83260,0.2151,19.83,"C:\Media\Projet\Informatique\M1\Projet MNajib\storage\processed\Journal des Goncourt (Deuxième série, premier volume)_clean.txt"
92d17050-bd3d-44f7-94dc-3ee7d439f85f,Histoire du Canada depuis sa découverte jusqu'à nos jours. Tome I,F.-X. (François-Xavier) Garneau,histoire,2008,français,118608,0.1609,22.41,C:\Media\Projet\Informatique\M1\Projet MNajib\storage\processed\Histoire du Canada depuis sa découverte jusqu'à nos jours. Tome I_clean.txt
c2f0421e-f144-41fd-9d64-a1d3ee04a18f,Les gens de théâtre,Pierre Véron,theatre,2020,français,36582,0.2973,10.39,C:\Media\Projet\Informatique\M1\Projet MNajib\storage\processed\Les gens de théâtre_clean.txt
3b45e79c-4c02-45ec-9462-4ab2ea40d36a,Poil de Carotte,Jules Renard,jeunesse,2003,français,33222,0.2458,11.12,C:\Media\Projet\Informatique\M1\Projet MNajib\storage\processed\Poil de Carotte_clean.txt
a9f0c3f7-97a2-419e-ac7c-d7d9a2da4d67,Dans l'abîme,H. G. (Herbert George); Figuier Wells,roman_science_fiction,2021,français,13857,0.3254,15.1,C:\Media\Projet\Informatique\M1\Projet MNajib\storage\processed\Dans l'abîme_clean.txt
40f96246-09be-4aa0-99f3-9a33416d66e7,Les quinze joyes de mariage Conforme au manuscript de la bibliothèque publique de Rouen,Antoine de La Sale,roman_satirique,2021,français,46471,0.1928,16.15,C:\Media\Projet\Informatique\M1\Projet MNajib\storage\processed\Les quinze joyes de mariage_clean.txt
6144ceb6-507a-464c-8ca4-6f9af6556e85,Histoire de France 1715-1723 (Volume 17/19),Jules Michelet,histoire,2009,français,97684,0.2084,14.29,C:\Media\Projet\Informatique\M1\Projet MNajib\storage\processed\Histoire de France 1715-1723 (Volume 17 19)_clean.txt
0f33c884-946c-48bc-a712-51bc92ac7575,Un mousse de Surcouf,Pierre Maël,roman_historique,2023,français,62059,0.1954,15.69,C:\Media\Projet\Informatique\M1\Projet MNajib\storage\processed\Un mousse de Surcouf_clean.txt
0d42dae1-1426-4208-bd22-4966df683872,Voyage en Égypte et en Syrie - Tome 1,C.-F. (Constantin-François) Volney,voyage,2011,français,103426,0.1889,26.12,C:\Media\Projet\Informatique\M1\Projet MNajib\storage\processed\Voyage en Égypte et en Syrie - Tome 1_clean.txt
aa25aaef-6e90-4f93-bf3b-c3cf0429af3c,La dette de jeu (1572),P. L. Jacob,roman_historique,2011,français,68526,0.2185,17.25,C:\Media\Projet\Informatique\M1\Projet MNajib\storage\processed\La dette de jeu (1572)_clean.txt
73c55d53-1bad-48d9-8d5a-06dc36cba43b,"Le Rhin, Tome III",Victor Hugo,voyage,2012,français,56013,0.2473,19.48,"C:\Media\Projet\Informatique\M1\Projet MNajib\storage\processed\Le Rhin, Tome III_clean.txt"
dcd16c27-f784-4689-9831-659ea57bb801,Bêtes et gens qui s'aimèrent,Claude Farrère,nouvelle,2018,français,36170,0.2918,11.78,C:\Media\Projet\Informatique\M1\Projet MNajib\storage\processed\Bêtes et gens qui s'aimèrent_clean.txt
8a245c28-3b65-4237-b1b5-3e6553a40459,"Histoire des Musulmans d'Espagne, t. 1/4 jusqu'à la conquête de l'Andalouisie par les Almoravides (711-1100)",Reinhart Pieter Anne Dozy,histoire,2012,français,87623,0.1846,20.59,"C:\Media\Projet\Informatique\M1\Projet MNajib\storage\processed\Histoire des Musulmans d'Espagne, t. 1 4_clean.txt"
bef240e9-29e1-4f84-8cb0-5aa59f6d1452,Mémoires d'un artiste,Charles Gounod,biographie,2008,français,48853,0.2336,22.66,C:\Media\Projet\Informatique\M1\Projet MNajib\storage\processed\Mémoires d'un artiste_clean.txt
8488db0f-fcbc-45b7-9219-b28f2eacb29c,"La Panhypocrisiade, ou le spectacle infernal du seizième siècle",Népomucène-Louis Lemercier,poetique,2017,français,73476,0.2515,13.01,"C:\Media\Projet\Informatique\M1\Projet MNajib\storage\processed\La Panhypocrisiade, ou le spectacle infernal du seizième siècle_clean.txt"
da8269c6-9d8e-4bc3-a946-c31503254532,Amours d'Extrême-Orient Illustrations d'après nature par Amédée Vignola,Olivier; Vignola Diraison-Seylor,essai,2021,français,34653,0.2801,21.19,C:\Media\Projet\Informatique\M1\Projet MNajib\storage\processed\Amours d'Extrême-Orient_clean.txt
cd367264-4d27-4114-9642-0f83028c4460,Le Canapé couleur de feu,Louis Charles Fougeret de Monbron,roman_amour,2019,français,9008,0.3569,21.11,C:\Media\Projet\Informatique\M1\Projet MNajib\storage\processed\Le Canapé couleur de feu_clean.txt
bb7850bc-960b-4fa2-904d-a33203882d06,"Collection complète des oeuvres de l'Abbé de Mably, Volume 1 (of 15)",Gabriel Bonnot de; Brizard Mably,essai,2016,français,108644,0.1676,23.18,"C:\Media\Projet\Informatique\M1\Projet MNajib\storage\processed\Collection complète des oeuvres de l'Abbé de Mably, Volume 1 (of 15)_clean.txt"
9e875fec-c357-49a5-bb17-e302d22a667c,L'Odyssée,751? BCE-651? BCE; Leconte de Lisle [Translator] Homer,mythe_legende,2004,français,112722,0.1227,22.59,C:\Media\Projet\Informatique\M1\Projet MNajib\storage\processed\L'Odyssée_clean.txt
74047f5e-47f2-4916-8847-42c314368bd4,Cours familier de Littérature - Volume 21,Alphonse de Lamartine,essai,2012,français,75647,0.2064,26.15,C:\Media\Projet\Informatique\M1\Projet MNajib\storage\processed\Cours familier de Littérature - Volume 21_clean.txt
0ecf50ed-ddc6-44c0-98a9-1eaf6a669e8a,Les fiançailles: Féerie en cinq actes et onze tableaux,Maurice Maeterlinck,theatre,2012,français,20543,0.237,9.33,C:\Media\Projet\Informatique\M1\Projet MNajib\storage\processed\Les fiançailles Féerie en cinq actes et onze tableaux_clean.txt
a4f78bc9-1e0c-49eb-8837-63dc6ea9997d,Les misérables Tome IV: L'idylle rue Plumet et l'épopée rue Saint-Denis,Victor Hugo,roman_historique,2006,français,120288,0.1934,14.79,C:\Media\Projet\Informatique\M1\Projet MNajib\storage\processed\Les misérables Tome IV L'idylle rue Plumet et l'épopée rue Saint-Denis_clean.txt
c401d5ef-0f6a-4edc-bd60-d5a4db059945,Les Jeudis de Madame Charbonneau,Armand Pontmartin,roman_satirique,2013,français,74259,0.2505,21.27,C:\Media\Projet\Informatique\M1\Projet MNajib\storage\processed\Les Jeudis de Madame Charbonneau_clean.txt
969b803e-5a4a-4726-9566-87eb742bf73f,"Œuvres complètes de lord Byron, Tome 01 avec notes et commentaires, comprenant ses mémoires publiés par Thomas Moore",George Gordon Byron Byron,poetique,2008,français,116277,0.2064,18.88,"C:\Media\Projet\Informatique\M1\Projet MNajib\storage\processed\Œuvres complètes de lord Byron, Tome 01_clean.txt"
5f2244f5-c64a-4e00-864d-ab276753667c,A l'ombre des jeunes filles en fleurs - Première partie,Marcel Proust,biographie,2001,français,68184,0.1921,30.2,C:\Media\Projet\Informatique\M1\Projet MNajib\storage\processed\A l'ombre des jeunes filles en fleurs - Première partie_clean.txt
ba729772-0314-4553-9fbf-aa56490fdd1f,"Histoire du Consulat et de l'Empire, (Vol. 02 / 20) faisant suite à l'Histoire de la Révolution Française",Adolphe Thiers,roman_historique,2008,français,118681,0.1485,21.52,"C:\Media\Projet\Informatique\M1\Projet MNajib\storage\processed\Histoire du Consulat et de l'Empire, (Vol. 02 20)_clean.txt"
f65a84a1-e0f5-4f67-8ffd-6a98a90f9eca,"Correspondance inédite de Hector Berlioz, 1819-1868",Hector; Bernard Berlioz,biographie,2009,français,94555,0.1937,15.7,"C:\Media\Projet\Informatique\M1\Projet MNajib\storage\processed\Correspondance inédite de Hector Berlioz, 1819-1868_clean.txt"
351607a0-73dd-44af-8ba6-69d6b8e19a77,"L'Illustration, No. 3673, 19 Juillet 1913",Various,presse,2012,français,18115,0.3463,19.93,"C:\Media\Projet\Informatique\M1\Projet MNajib\storage\processed\L'Illustration, No. 3673, 19 Juillet 1913_clean.txt"
05930c3c-bf49-4d72-b293-3073e3287373,Contes cruels,Auguste Villiers de L'Isle-Adam,nouvelle,2020,français,77003,0.2519,15.12,C:\Media\Projet\Informatique\M1\Projet MNajib\storage\processed\Contes cruels_clean.txt
8ede2c16-dbc7-4358-a2ab-28679dfaed9e,Promenades autour d'un village,George Sand,voyage,2004,français,44056,0.2601,21.19,C:\Media\Projet\Informatique\M1\Projet MNajib\storage\processed\Promenades autour d'un village_clean.txt
16b02065-9edd-4ccc-a550-0785ce95aebd,Les compagnons de Jéhu,Alexandre Dumas,roman_historique,2004,français,196527,0.1338,16.55,C:\Media\Projet\Informatique\M1\Projet MNajib\storage\processed\Les compagnons de Jéhu_clean.txt
0f3c05bb-b888-4d9a-b066-4f63045326ff,... Et l'horreur des responsabilités (suite au Culte de l'incompétence),Émile Faguet,essai,2025,français,42155,0.1779,27.19,C:\Media\Projet\Informatique\M1\Projet MNajib\storage\processed\... Et l'horreur des responsabilités (suite au Culte de l'incompétence)_clean.txt
c6f1aa2a-0f8c-4a9c-a809-cc6bc7db633a,"Œuvres Complètes de Frédéric Bastiat, tome 5 mises en ordre, revues et annotées d'après les manuscrits de l'auteur",Frédéric; Paillottet Bastiat,essai,2014,français,167221,0.1443,19.0,"C:\Media\Projet\Informatique\M1\Projet MNajib\storage\processed\Œuvres Complètes de Frédéric Bastiat, tome 5_clean.txt"
6793e001-21a1-4117-8d6f-1bbba90a95eb,La mer et les marins Scènes maritimes,Edouard Corbière,roman_aventures,2005,français,50970,0.232,18.93,C:\Media\Projet\Informatique\M1\Projet MNajib\storage\processed\La mer et les marins_clean.txt
c4b78b50-f3d5-4ec4-8c24-4efca4e81069,Le juif errant - Tome II,Eugène Sue,roman_historique,2005,français,289264,0.1251,14.52,C:\Media\Projet\Informatique\M1\Projet MNajib\storage\processed\Le juif errant - Tome II_clean.txt
a7ff75ad-98c0-4364-8e5d-c5efaa487ef1,"Mémoires d'Outre-Tombe, Tome 4",François-René Chateaubriand,roman_historique,2008,français,146919,0.1802,19.16,"C:\Media\Projet\Informatique\M1\Projet MNajib\storage\processed\Mémoires d'Outre-Tombe, Tome 4_clean.txt"
255b3efc-090b-4f4f-afd0-f0e6e9d62551,"Œuvres de P. Corneille, Tome 01",Pierre; Marty-Laveaux Corneille,theatre,2010,français,174657,0.1507,14.74,"C:\Media\Projet\Informatique\M1\Projet MNajib\storage\processed\Œuvres de P. Corneille, Tome 01_clean.txt"
89ff3c24-ce90-4cd4-83db-5c1cf9b54f9e,"Bulletin de Lille, 1916.08 publié sous le contrôle de l'autorité allemande",Anonymous,roman_historique,2008,français,46726,0.1957,8.36,"C:\Media\Projet\Informatique\M1\Projet MNajib\storage\processed\Bulletin de Lille, 1916.08_clean.txt"
17a191bc-39b3-4890-85bd-461461cf52de,"Les Divins Oracles de Zoroastre, ancien Philosophe Grec, Interpretez en Rime Françoise, par François Habert de Berry; Avec un Commentaire moral sur ledit Zoroastre, en Poesie Françoise, et Latine.",François Habert,poetique,2013,français,16868,0.3275,24.99,"C:\Media\Projet\Informatique\M1\Projet MNajib\storage\processed\Les Divins Oracles de Zoroastre, ancien Philosophe Grec, Interpretez en Rime Françoise, par François Habert de Berry; Av_clean.txt"
902d44e6-8d8c-4dc6-b7ab-825d066f6cdb,Expédition des dix mille,432 BCE-351? BCE; Rousset Xenophon,histoire,2023,français,82740,0.1426,22.91,C:\Media\Projet\Informatique\M1\Projet MNajib\storage\processed\Expédition des dix mille_clean.txt
9e455992-8671-4904-86a7-0044df3208c1,Brelan des dames,Robert Montesquiou-Fézensac,essai,2022,français,30723,0.2863,21.47,C:\Media\Projet\Informatique\M1\Projet MNajib\storage\processed\Brelan des dames_clean.txt
326fe76a-9ad3-4093-97e3-c03c9da2c8a0,"L'Illustration, No. 0017, 24 Juin 1843",Various,presse,2011,français,28205,0.3029,20.91,"C:\Media\Projet\Informatique\M1\Projet MNajib\storage\processed\L'Illustration, No. 0017, 24 Juin 1843_clean.txt"
dc074379-5eb7-4087-950f-7b85d79b0b8e,"Le Rhin, Tome I",Victor Hugo,voyage,2013,français,58837,0.2451,19.63,"C:\Media\Projet\Informatique\M1\Projet MNajib\storage\processed\Le Rhin, Tome I_clean.txt"
a4c7ee86-2af9-4330-881c-c420218dd7d3,Itinéraires,Louis Hémon,biographie,2023,français,11655,0.2969,32.19,C:\Media\Projet\Informatique\M1\Projet MNajib\storage\processed\Itinéraires_clean.txt
35dd5f01-0e2a-430a-be78-7c5dbafd7a5a,"Mémoires d'Outre-Tombe, Tome 1",François-René Chateaubriand,roman_historique,2006,français,169875,0.191,19.46,"C:\Media\Projet\Informatique\M1\Projet MNajib\storage\processed\Mémoires d'Outre-Tombe, Tome 1_clean.txt"
4f7ea46e-70c1-4033-a042-f920fb0556f0,Le roman d'un jeune homme pauvre (Novel),Octave Feuillet,roman_amour,2008,français,55684,0.2255,18.37,C:\Media\Projet\Informatique\M1\Projet MNajib\storage\processed\Le roman d'un jeune homme pauvre (Novel)_clean.txt
f1d57702-e9c1-4706-8bf9-5c187ab2bbb0,"Madame Sans-Gêne, Tome 3 Le Roi de Rome",Edmond; Moreau Lepelletier,roman_historique,2013,français,86562,0.2207,15.05,"C:\Media\Projet\Informatique\M1\Projet MNajib\storage\processed\Madame Sans-Gêne, Tome 3_clean.txt"
56fdc86c-07c4-40aa-8049-68d5dd329f48,Les Romanesques: comédie en trois actes en vers,Edmond Rostand,theatre,2018,français,12199,0.3515,5.21,C:\Media\Projet\Informatique\M1\Projet MNajib\storage\processed\Les Romanesques comédie en trois actes en vers_clean.txt
dfdde720-9b16-4b47-8256-9c434bec68e3,Contes à Jeannot,Jules Girardin,jeunesse,2004,français,12809,0.2931,16.9,C:\Media\Projet\Informatique\M1\Projet MNajib\storage\processed\Contes à Jeannot_clean.txt
0dfd3c2f-4897-483c-b118-857785d1fdb5,"Quelques écrivains français: Flaubert, Zola, Hugo, Goncourt, Huysmans, etc.",Emile Hennequin,essai,2004,français,45640,0.2746,29.19,"C:\Media\Projet\Informatique\M1\Projet MNajib\storage\processed\Quelques écrivains français Flaubert, Zola, Hugo, Goncourt, Huysmans, etc_clean.txt"
01e5d57d-4389-4005-8323-42abde35e8ee,Correspondance: Les lettres et les arts,Émile Zola,epistolaire,2018,français,89158,0.1701,14.19,C:\Media\Projet\Informatique\M1\Projet MNajib\storage\processed\Correspondance Les lettres et les arts_clean.txt
409f29e2-c643-4c17-9c27-24af1643ab2f,Variétés Historiques et Littéraires (10/10) Recueil de pièces volantes rares et curieuses en prose et en vers,Edouard [Editor] Fournier,essai,2015,français,81788,0.2443,12.74,C:\Media\Projet\Informatique\M1\Projet MNajib\storage\processed\Variétés Historiques et Littéraires (10 10)_clean.txt
21368af7-b5de-4581-9dc9-9a0b3a1b6b88,Monsieur Lecoq — Volume2 L'honneur du nom,Emile Gaboriau,roman_policier,2008,français,155505,0.1584,12.51,C:\Media\Projet\Informatique\M1\Projet MNajib\storage\processed\Monsieur Lecoq — Volume2_clean.txt
fafb8224-64b0-40d9-a0f0-3d9dd054d22f,"Chroniques de J. Froissart, tome 11/13",Jean Froissart,roman_historique,2023,français,189227,0.1254,7.14,"C:\Media\Projet\Informatique\M1\Projet MNajib\storage\processed\Chroniques de J. Froissart, tome 11 13_clean.txt"
1437e903-68d2-4d37-ba2c-5338d06a37b5,"L'Anglais mangeur d'opium Traduit de l'Anglais et augmenté par Alfred de Musset, avec une notice par M. Arthur Heulhard",Thomas; Heulhard De Quincey,biographie,2023,français,29290,0.2482,24.24,C:\Media\Projet\Informatique\M1\Projet MNajib\storage\processed\L'Anglais mangeur d'opium_clean.txt
87ae9863-c805-49f3-8d6c-d95d1b2d7961,"Correspondance, 1812-1876 — Tome 1",George Sand,epistolaire,2004,français,84121,0.1828,15.3,"C:\Media\Projet\Informatique\M1\Projet MNajib\storage\processed\Correspondance, 1812-1876 — Tome 1_clean.txt"
19cea70f-9d69-4e10-9214-6f2fd7e2ba5a,"Histoire des salons de Paris (Tome 5/6) Tableaux et portraits du grand monde sous Louis XVI, Le Directoire, le Consulat et l'Empire, la Restauration et le règne de Louis-Philippe Ier",Laure Junot Abrantès,essai,2014,français,81925,0.1799,17.4,C:\Media\Projet\Informatique\M1\Projet MNajib\storage\processed\Histoire des salons de Paris (Tome 5 6)_clean.txt
c36275ec-ce7d-462e-805d-530a69dcee72,Histoire de France 1440-1465 (Volume 7/19),Jules Michelet,histoire,2013,français,90967,0.2165,18.0,C:\Media\Projet\Informatique\M1\Projet MNajib\storage\processed\Histoire de France 1440-1465 (Volume 7 19)_clean.txt
767113bd-39aa-4796-a719-5e00529975c3,Le roman d'un jeune homme pauvre (Play),Octave Feuillet,theatre,2008,français,25810,0.2419,5.53,C:\Media\Projet\Informatique\M1\Projet MNajib\storage\processed\Le roman d'un jeune homme pauvre (Play)_clean.txt
81aa01ed-0d7b-4571-ad53-35d66e5d0ae9,Han d'Islande,Victor Hugo,roman_policier,2004,français,128268,0.1538,16.37,C:\Media\Projet\Informatique\M1\Projet MNajib\storage\processed\Han d'Islande_clean.txt
2ea180cd-b4e3-4016-b772-4f587ce26427,Fantasques: Petits poèmes de propos divers,Auguste Gilbert de Voisins,poetique,2022,français,34510,0.2908,17.95,C:\Media\Projet\Informatique\M1\Projet MNajib\storage\processed\Fantasques Petits poèmes de propos divers_clean.txt
c5b81b28-331f-4a0c-a6f8-212d31589ea2,Nos femmes de lettres,Paul Flat,essai,2009,français,32302,0.2669,25.93,C:\Media\Projet\Informatique\M1\Projet MNajib\storage\processed\Nos femmes de lettres_clean.txt
068e5553-c245-4360-a7c6-9aa3215fbb9e,Visages,Francis Chevassu,essai,2015,français,33642,0.3128,18.51,C:\Media\Projet\Informatique\M1\Projet MNajib\storage\processed\Visages_clean.txt
65c329cf-bf77-4087-8b8a-35e688431df4,"Chronique de 1831 à 1862, Tome 2 (de 4)",Dorothée Dino,essai,2015,français,155406,0.152,17.66,"C:\Media\Projet\Informatique\M1\Projet MNajib\storage\processed\Chronique de 1831 à 1862, Tome 2 (de 4)_clean.txt"
fe855922-482a-4e3b-a736-cfe479460653,"Lettres persanes, tome I",Charles de Secondat Montesquieu,epistolaire,2009,français,57511,0.2116,20.34,"C:\Media\Projet\Informatique\M1\Projet MNajib\storage\processed\Lettres persanes, tome I_clean.txt"
ce30b262-b635-4236-8d73-73e3e25d38f1,"Mémoires d'une contemporaine. Tome 2 Souvenirs d'une femme sur les principaux personnages de la République, du Consulat, de l'Empire, etc...",Ida Saint-Elme,histoire,2009,français,67416,0.1909,18.95,C:\Media\Projet\Informatique\M1\Projet MNajib\storage\processed\Mémoires d'une contemporaine. Tome 2_clean.txt
7fc103b5-f105-4547-baa4-b5946a6a080c,Pour la patrie: Roman du XXe siècle,Jules Paul Tardivel,histoire,2005,français,76810,0.1936,15.37,C:\Media\Projet\Informatique\M1\Projet MNajib\storage\processed\Pour la patrie Roman du XXe siècle_clean.txt
e4416fc9-4615-4154-a4d1-a33ce930dbb0,Les petits vagabonds,Jeanne; Bayard Marcel,jeunesse,2006,français,40506,0.2286,14.75,C:\Media\Projet\Informatique\M1\Projet MNajib\storage\processed\Les petits vagabonds_clean.txt
366f479f-76a3-4145-86e7-53c31622e3d2,Journal de Jean Héroard - Tome 1 Sur l'enfance et la jeunesse de Louis XIII (1601-1610),Jean Héroard,roman_historique,2014,français,194479,0.1156,14.03,C:\Media\Projet\Informatique\M1\Projet MNajib\storage\processed\Journal de Jean Héroard - Tome 1_clean.txt
1815229e-f944-416c-852e-7eecfa025181,En Alsace,André Lichtenberger,voyage,2020,français,20718,0.3426,17.36,C:\Media\Projet\Informatique\M1\Projet MNajib\storage\processed\En Alsace_clean.txt
66688748-b3db-407a-9450-9f162084cb48,"Œuvres de Napoléon Bonaparte, Tome III.",Emperor of the French; Panckoucke Napoleon I,histoire,2004,français,142673,0.1371,20.98,"C:\Media\Projet\Informatique\M1\Projet MNajib\storage\processed\Œuvres de Napoléon Bonaparte, Tome III_clean.txt"
f5bf1437-bdf3-4dcf-a427-5c9964f1927d,Les petites alliées,Claude Farrère,roman_amour,2015,français,75475,0.2343,10.88,C:\Media\Projet\Informatique\M1\Projet MNajib\storage\processed\Les petites alliées_clean.txt
2baac4da-90dc-4778-b3ca-3959b80de917,Un amant,Emily; Wyzewa Brontë,roman_psychologique,2020,français,110274,0.1528,17.91,C:\Media\Projet\Informatique\M1\Projet MNajib\storage\processed\Un amant_clean.txt
61997d50-2dd4-47f1-a89b-d416ad02b64b,Odes d'Anacréon Traduction littérale et rythmique,574? BCE-496? BCE; Machard Anacreon,poetique,2008,français,6719,0.4112,15.12,C:\Media\Projet\Informatique\M1\Projet MNajib\storage\processed\Odes d'Anacréon_clean.txt
a24ea817-bd6b-45ea-91de-e6c63aa62c6d,"L'Illustration, No. 1602, 8 novembre 1873",Various,presse,2014,français,17213,0.3378,20.23,"C:\Media\Projet\Informatique\M1\Projet MNajib\storage\processed\L'Illustration, No. 1602, 8 novembre 1873_clean.txt"
b285ce34-2564-4615-8ff6-1de44897d1b8,Les deux nigauds,Sophie Ségur,roman_satirique,2004,français,49975,0.2145,11.65,C:\Media\Projet\Informatique\M1\Projet MNajib\storage\processed\Les deux nigauds_clean.txt
85228061-84cd-4701-98be-9c4d849d3038,La Mort Amoureuse: Poésie,Huguette Bertrand,poetique,2003,français,4937,0.3571,352.71,C:\Media\Projet\Informatique\M1\Projet MNajib\storage\processed\La Mort Amoureuse Poésie_clean.txt
35c4b406-3178-4090-8c4e-bca0e4e3c615,Le Jour des Rois,William; Guizot Shakespeare,theatre,2005,français,25837,0.2881,8.85,C:\Media\Projet\Informatique\M1\Projet MNajib\storage\processed\Le Jour des Rois_clean.txt
822b2304-88f4-415c-a5eb-ba40c22c16dd,"Monsieur Parent, et autres histoires courtes",Guy de Maupassant,nouvelle,2004,français,45763,0.2484,11.86,"C:\Media\Projet\Informatique\M1\Projet MNajib\storage\processed\Monsieur Parent, et autres histoires courtes_clean.txt"
4d016744-27dc-4c58-9d52-d495272a5e74,Deux contes: Le massacre des Innocents; Onirologie.,Maurice Maeterlinck,nouvelle,2021,français,10620,0.3157,30.57,C:\Media\Projet\Informatique\M1\Projet MNajib\storage\processed\Deux contes Le massacre des Innocents; Onirologie_clean.txt
4d2ec142-4987-4596-996f-a5dea9419a7c,Abrégé de l'Histoire Générale des Voyages (Tome 1),Jean-François de La Harpe,voyage,2007,français,89908,0.1693,25.06,C:\Media\Projet\Informatique\M1\Projet MNajib\storage\processed\Abrégé de l'Histoire Générale des Voyages (Tome 1)_clean.txt
5371825d-b984-4285-931b-f673fc98b5f8,En ballon! Pendant le siege de Paris,Gaston Tissandier,histoire,2004,français,79962,0.1937,14.55,C:\Media\Projet\Informatique\M1\Projet MNajib\storage\processed\En ballon! Pendant le siege de Paris_clean.txt
9a9274de-68a1-4dbf-b017-a4158ebd2829,Philoctète,André Gide,essai,2023,français,21404,0.2713,13.88,C:\Media\Projet\Informatique\M1\Projet MNajib\storage\processed\Philoctète_clean.txt
217cea07-6315-44b4-9f28-42ad264a3109,"La foire aux vanités, Tome I",William Makepeace; Guiffrey Thackeray,roman_satirique,2006,français,146731,0.152,18.57,"C:\Media\Projet\Informatique\M1\Projet MNajib\storage\processed\La foire aux vanités, Tome I_clean.txt"
dc18cb45-3578-436b-baaf-83194597b9d5,Ceci n'est pas un conte,Denis; Assézat Diderot,nouvelle,2009,français,8594,0.3572,13.19,C:\Media\Projet\Informatique\M1\Projet MNajib\storage\processed\Ceci n'est pas un conte_clean.txt
6a3813b1-3f6a-41bf-bd31-187cd44d585e,Essais de Montaigne (self-édition) - Volume II,Michel de; Michaud [Translator] Montaigne,essai,2015,français,314335,0.1416,34.62,C:\Media\Projet\Informatique\M1\Projet MNajib\storage\processed\Essais de Montaigne (self-édition) - Volume II_clean.txt
88435d81-983a-436c-9412-9dab48c1e1ad,Post-scriptum de ma vie,Victor Hugo,essai,2020,français,51499,0.2574,14.73,C:\Media\Projet\Informatique\M1\Projet MNajib\storage\processed\Post-scriptum de ma vie_clean.txt
0dbcdd0f-2c50-4b87-ac01-bdf39f9829f9,"Les mystères du peuple, Tome III Histoire d'une famille de prolétaires à travers les âges",Eugène Sue,roman_historique,2009,français,98140,0.1942,15.64,"C:\Media\Projet\Informatique\M1\Projet MNajib\storage\processed\Les mystères du peuple, Tome III_clean.txt"
29c99d6c-d5af-49b2-843a-342a087e2e9f,Le Capitaine Aréna — Tome 1,Alexandre Dumas,voyage,2005,français,50721,0.2149,23.0,C:\Media\Projet\Informatique\M1\Projet MNajib\storage\processed\Le Capitaine Aréna — Tome 1_clean.txt
0b13a70c-01ef-4227-91c8-8c3163e6dbde,"L'Illustration, No. 0048, 27 Janvier 1844",Various,presse,2013,français,29652,0.3043,20.56,"C:\Media\Projet\Informatique\M1\Projet MNajib\storage\processed\L'Illustration, No. 0048, 27 Janvier 1844_clean.txt"
9f05a116-95b8-4755-91a2-59a15461b626,Souvenirs d'une actrice (3/3),Louise Fusil,roman_historique,2008,français,7272,0.3552,17.88,C:\Media\Projet\Informatique\M1\Projet MNajib\storage\processed\Souvenirs d'une actrice (3 3)_clean.txt
422df940-0170-4f50-b6d7-01a7bd1e74fd,Cours familier de Littérature - Volume 23,Alphonse de Lamartine,essai,2015,français,96835,0.2005,16.32,C:\Media\Projet\Informatique\M1\Projet MNajib\storage\processed\Cours familier de Littérature - Volume 23_clean.txt
54749359-cd17-4897-9eb1-b4553bf5bdfd,A travers la Russie boréale,Charles Rabot,voyage,2025,français,70465,0.2111,16.07,C:\Media\Projet\Informatique\M1\Projet MNajib\storage\processed\A travers la Russie boréale_clean.txt
ecb96c4b-5065-42ca-9c75-a8239b0e1672,L'ingénieux chevalier Don Quichotte de la Manche,Miguel de; Roux Cervantes Saavedra,roman_amour,2013,français,345901,0.1025,28.82,C:\Media\Projet\Informatique\M1\Projet MNajib\storage\processed\L'ingénieux chevalier Don Quichotte de la Manche_clean.txt
4fe425c5-d197-4b1a-a092-d21d692d418c,Le roi Jean,William; Guizot Shakespeare,theatre,2007,français,27350,0.2866,13.02,C:\Media\Projet\Informatique\M1\Projet MNajib\storage\processed\Le roi Jean_clean.txt
c3d514c1-b553-4b92-9437-10fe5c17a598,Le Côté de Guermantes - Troisième partie,Marcel Proust,biographie,2004,français,81964,0.1831,25.6,C:\Media\Projet\Informatique\M1\Projet MNajib\storage\processed\Le Côté de Guermantes - Troisième partie_clean.txt
